そだぞ	私は美少女戦士前原だよ
3枚目の悠仁やばい、好き️️	私もこの悠仁お気に入り️
あれ、たまに見たくなるんですよね…	分かるわ、私も見たりしているし
いつも絡んでくれるし大好きだから	私も大好き
やはりそうか通報していい 	え 私をかい 
もっと近く行けるようにがんばるね 	うなたん私の気持ちは一軍だよっ️
いつか一緒にインしたいです…	わ、わ、私だってぇ  
の国行きたい誰か一緒に行こ	私今度行く  
私は男だ  	今まで、私って言ってたから女性かと  
今まで、私って言ってたから女性かと  	確かに最近私って言うこと多いな  
きになる	私も気になる
紛争センターに持ち込みだ   	私は負けません、勝つまで戦うので
今まで寝てたわ	おは私も今起きた
ダイソー行くモチベほしいだれか、、	私も行く   
外に出る気失せてきた	私も一緒に行く
可愛い 	だよね  私も惚れた
どうしたあああああ	私は疲れた。。。
したい相手に選ばれたら嬉しい…	私あなたの嫌いなデブだから
発送メール来いや	私は発送メール食べられました 
大好き	私の方が大好き 
 ﾟσωﾟ ・・・え 	そう 私は純粋てへっ
チキン伝心	ケンタで繋がる私たち
新潟県民全聖人	東京人歩行速度鬼早私遅
代わりに見ますね	お願いします私は明日にでも見ます
今ランクしてるから低いよ笑	私をダイヤ3に連れて行って 
日替わりで寝落ち相手欲しい   	その中の一人で私しめ
ランクインちてた 好き	私も好きー  
うふふふ尊死するお部屋の完成	私お部屋入れないよ
具体的にアドバイスせんかい	私婚活したことないから…
俺な	無理私
働けど働けど	私は早く副業先を決めないと
そうなんよ忘れるし時間もないし 笑 	私もそういうゲーム多々あるわw
なぴさんの知恵を拝借 	レベシェア8 2でおけ 私も8
ウマスンギwww	もしかして私…ウマイ 
  ´˘   だーい好き	私も ノ ´з｀ ノ 
たくさん絡みたい‍️	私も
声だけならいける 	私も声だけでやる  私からひらくね 
あなたも… 	うん 私はいつも元気だよ  クスッ
アニラは今年も平日っぽいけど	私のためだなそれは️  
あれ、男だっけ女性かと思ってた	私は男だ  
遠距離しんどい笑	それなとかなんで元彼に言うの私は。
ダークモカチップ️	私それ飲んだことない 飲んでみたい 
お疲れ様でした気付いたら寝てたw	私もですw
今日もえらい 	私も仕事行きたい。
繋がろ繋がろ  	私のサブ垢でもフォローしといたよ
もう身長いらないですよw	私は後20センチほしい 
私はこの場面好き	遠子さん私もー
やりたくないよ動かさないで	私の機械故障してる 
どいうこと w	私が1番聞きたいんだが  w
すきだから	私も好き
ため大歓迎なんで絡んでくださいっ  	私の方もタメ大歓迎なので気軽に 
愛してるよ	私も愛してるよ、あいこ
ゲームしてたら眠くなると信じる	私を召喚するのも一つの手ですよ。
仕事えらい	えらい私えらい
似てるってだけだよおおお	私ギター全然分からないからすんごおいい
かっこよくなりましょう	私はすでに真剣佑を超えてます
化猫の呪い w	1500円払った私が化けたいですよ
大好き感謝	私も雪のこと大好きー  ´˘    
すご笑ゴールドで沼っております	私もゴールドでめちゃ沼ったw
え  寝さして	私寝れないじゃん  
え、可愛いやーん️	私が中学生の時のやつ 
いぇいにゃん 	私も暇にゃん
それは相手が悪い ˙꒳˙ 	だよね、 私悪くないもん   
くらげちゃん、嬉しーい	私もリプしてくれて嬉しいよ
安心しろしらすが真のブスだ	違う私が真のブスだ
なるほど 	私もよくわかんないですけど
はな	私が開けたら牛になってまう
大好き	ありがとう 私もゆづちゃん大好きよ
朝からすげぇー	なんか今日は私やる気あるみたいw
混んでる時間帯避けて早めにした結果よ	早めと思って私は12時から
5RTはいかない気がする	私のメイドかなぁ
やっぱ自分の声好きくない	私は好きだから問題ないね 
僕3時に寝た	私もそのくらい  
突然のギドゥンドゥンwww	私も爆笑
鈴木田中味噌汁	ちょ私の真似やめてもらて
みつけよっ  楽しみ  	私も見つけるるあ  ω  
れなちゃんおもろい笑	私なんもしちょらんよ笑
はやくきて	私のセリフだー   www
すごいなードキドキする	わかちゃーん️私も見てるー
エルヴィン強すぎです…	私、団長生かせてないんですよね
帰ったらDLしときます	私もやっときまーす 
すき	私も好き 
えっ  お揃いコーデできる	あ、でも私の半袖バージョン 
どういうことだってばよ	私のデデデが弱すぎるってばよ  
深雪ちゃんも 	私は、違いますよ
5万倍可愛いな	さすが私の推しメンです
58	やっぱり私モテちゃうから
相変わらず可愛いぃ大好きだよれとさん	ありがとう 私も大好きだよ
みんなの声が聞きたい	私も聞きたい   いや便乗すんな
なえも面白いけどw	私は、面白くないww
に嫉妬	私のために争わないで ˙࿁˙ 
優しい、好き	みぃちゃんー   私も好きらぶち 
競馬の前に、カーリングw	ナイスー←私も見てますw
だれかペントハウス見てる人いませんか… 	え ねえ私もみてた ペントハウス 笑
まさかの立候補者が近くにいたw	タダちゃんのフォロー私だけじゃないか
俺フィレオフィッシュ好き	私もー
これ以上の優しい世界は無い	私もこう生きたいと強く思いました
絶対まお可愛いよね        圧	私そんなにブサイクじゃないよね    
うん、離れてから落ち着いた	良いな、私も早く一人暮らししたい
ごめん、、笑っていい  ww	私の仕業じゃないと思いたい   
俺の方が 	いや私な  
精神年齢で言うとまろんの方が高い	私の心は小学生ですことよ  
こんなにいるんですか 	せやで、ファンキー守部私より友達多い
わたし明日忙しすぎて草	荷造りとまつパと私と会う予定のせい 
おお 黒餡ですか 白餡かなぁ	私が食べた所のは白餡でした️
贵阳有主人爸爸吗 骚狗儿子想伺候主人爸爸	私聊
あ、自己紹介 	私君みたいにチビじゃないので違います
だいすきですよ	私もですよ
人をダメにするソファじゃん   	私はyogiboとかその類か
漫画で読んだ	私も読んだー‍️
イヤだーw1ヶ月白いスーモ辛いw	私2ヶ月d ˙꒳​˙  
仕事始まりますです	私も夜まで頑張りますですo  o  o
よくわかる変態がここにも…	私もや、。タブンツウホウサレルネ
すき	私も
一緒に幸せになりたいなあ	私はなぴくんがいるだけで幸せです 
もしかしてみられた 	私の脳内にこびり付いてますww
 っ ヮ c あれ 	私は一般人
大好きいいいいいい	ありがとうううう 私も大好きよー 
え、16歳  嬉しい	うん 16歳   私も嬉し
ゆきってよぶ  ≧ω≦ 	了解 私はなんて呼んだらいい 
笛もなかなか楽しいよ٩  ᐛ  و	私も奏でたい
3乙記録ですwww	大丈夫 私の最短は2分です 3乙 
やたやたたくさん絡むね	うん私もたくさん絡みに行く  
アッ…………おはようございます……	私の方が遅かったか… 
義ドゥンドゥン映った	私も密かに楽しんでおります
サブ垢でリンクコピーした  	あまって私もやろ   
同じく火曜日期末なんだけどヤバ	私は金曜日やで、、、、頑張ろう、、
残念ながらそれは無理やな	私もそんな値段で売るつもりはない
なかなか出来ることではありません	私には舟券という名の寄付しかw
おはよ今日寒い	おはよう️私があっためる…  
ほーい ≧∇≦ 	ありがとう私も仲良くするよ 
想要这个	私聊我呐
静岡愛知三重岐阜だって	にゃんさんありがとう私東海に住みたい
うどんたべすぎた	私今うどん食べようとしてた
これは…私には無理や	私もリングフィットはじめました 小声 
キャリパーブレーキ率25 	私も入ると20 になります笑
めっちゃわかります   	流石に私でも『やば・・・』ってなったw
ええ嬉し尊い空間でした	私も今度行こっと
FFかわいいやつばっかてわさいこー	あっやっぱり私って可愛すぎるよね。
ディスコードの鯖ですよね 	ですです 私の鯖でやることもあるので
フォローさせていただきます 	私もフォロー失礼します  
ねむた祭 開催決定 	おはようございます 私も開催中です
らぶです	私も 
あ、住んでらっしゃる	京セラドームは私の庭ですw
素敵な奥様	理解があって私にとって最高の妻です
おはよ りみちゃんかわいい 好き 	おはよう️ありがとう私も好き️
わーい ありがとう 	私デジタル絵苦手だから尊敬する。。
あれ楽しいw	私もやろwwww
わぁ   もうそれ最高だぁ    	私が落ち着きなくなりそう
好きぃ⸜  ॑॑  ⸝ 	ありがとう私も大好きだよ 
大好きすぎるから	私もみおの事大好き
ついでに拡張もしたいですっ	私も舌ピアスは拡張してますー 
チキンラーメン食べたい	私も食べたい
草	私はあんま使わないがな
グッズさんへ私のグッズはどこですか。	私のも来てないよ  誰食べたの 
おはようございます	おはよう私も今起きた
クールでこういうキャラ好き 	私もスキィィィィ
アイコン欲しいな ˙༥˙ 	私が描いてあげる   
コミュ力高い人	ゼロっち私の印象それ強いよねww
僕も、週3のペースで投資してますw	私よりもヘビーユーザー
すげーハミテージ感だな……懐かし……	私もハミテ思い出してました 笑 
今日届く  	いーないーな私はまだ動いてない
可愛いわんちゃん飼わせて	私のことだな← 
地雷系と量産型ほど好きな物ないですはい	量産型でも地雷系でもない私は何者
ぽぽさんナイス	私は安定の走ってるだけです笑笑
クンさん持ってるよん	でも私スカ所持ってない
️	私も大好きありがとう
東西間違えて逆方向行ってしまったキツ	私もです     
大会の終わりから乗り始めるスタイル	私と一緒ww
妹が可愛いと日々が潤うわね。	私は日々潤ってるけどね。別の意味で
もともと美人さんだしー	私もそう思いますぅ 
すき	かわいい私もすき
はい  もちろん書くぜ	わーい 私も書いてもいい  
なにみゅに巨乳なのか  あ  	私ら高一だから願いは届くぜ人並み
私の相棒だろ 	私はちさの相棒であり婚約者です  は
想吹	私訊約
あの先生キラァイ 	私もwwwあのクソババア  
えげつないことゆうやんwww	私をいじった罪は重いよw
喫茶店タバコ吸えないのでもー会場なう	私の昨日と同じ状況です
シンプルに好き   	私もちーちゃんすっきーっ  
找會晨勃的你私照或影片看多硬約	無法私訊
想吃	私訊約
それはちがうよ	私もたくさん傷つけたからだめなの
私も愛してるー とてぎもラブ️	私もケロちゃん愛してるラブ
えっ、会いたい	私も会いたい
ことも このがいるから頑張れる	私もこといないと生きていけません
俺は眠い	私も眠い寒い
あじちゃんもやってみてー 	私は親分でした
着いた TT 	私も着いた 
ありがとう	私は何も助けてはいませんけどね
まって推しおきてたの  	私も起きてるよんおは
ひぃぃ墓場まで持って行きます	私も嬉しすぎて持ってっちゃう‍️
07なので1個差かもしれない  	ほんとに  私今中1の代だよ
呼吸だけ常駐するようにした	それは私も笑笑
好きだしたくさん絡んでくれるから  	私もなのはのこと好き 
マニアック	私の好きなお菓子やさん映ったよ
好き	私の相棒だろ 
あたしゃしらたきニシパと遊びたいんだよ	私もでしてよ      
セイラちゃんいるの️私西3いる	おお 私も今西③にいるよ
とぅきやよ 	私はしゅき
メタフォース絶対お腹空くよねどうしよう	私の食え
先ほどようやく落ちました	私は何時になるのかなぁ 
左 	予想当たった はい私天才  
うん   すき   	私もすーき 
君は 	私はタイトロンの女戦闘員ですよ
想吃	私訊約
え、綺麗すぎん	私の腕のおかげかな←
好きなんですね  	私の推しの子です 
天文90しかないからさすがにルレ回すか…	私天文今週、0 ̳ ̫ ̳ 
尊敬しなくていいよw	私絶対食べれないww
秒でリプ   みっちょん 好き 	私もかっぴぃ好き両思い
想吹	私訊約
めっちゃ薄いし背高い スタイル抜群 	あ、違います私は字です
不具合 	私が知らなさすぎだけかも
なんだゆるる  	私が友達  
え、ありがとう、、好き。。。。  	嬉しい ありがとう私も大好きだよ 
強いっ…やるねぇ	私最強なんで笑
初耳の極みです… ﾟ ﾟ 	私もです 
友達出来るか心配になってきた	私もそれすごい心配
クラブハウス行きたいな。	私も行きたい
ビンドゥンドゥンのポシェット欲しい。	私、けっこう可愛いと思うの
可愛いなぁあありがとう 	私も1番初めに出た言葉可愛いやった…
ほんとそれ	私たちは運営に試されてますw
みたいもん←	私の 
そういえば文アの自分用イラスト本作らんと	私の分もたのむ。金なら出す
想	私訊約
っぁ…  	   今の相手は私です
いじめてください	私だけみてて
英語わからん	私も日本語が分かりません     
想	私訊約
ネギじゃ無いの️	ねー。私も拡大して見ちゃった
うんうん。分かります   笑 	やっぱり私だけじゃなかった… 笑
やった るあ料理下手だから嬉しい	私も下手だけどるあちゃのためなら
このツイ読んだ私もなんだか幸せ	私の週に1回の楽しみなの
ワクワクです ≧∇≦ 	私もです  ╹ ╹  
歯が砕けるww	wwww大丈夫だ 私の歯は硬いっww
【急募】第5人格、やる気の出る方法	私と一緒に遊ぶ  私が遊びたいだけ説 
好想看起來好好吃	私訊約
うれちい	私もうれしいよ
想	私訊約
ているんは唯一無二の歌声だね  	私にとっては
スタンプ忘れてた	あ、私もだ…詰んだ…
すき	私も大好きです   ロ⊂    
ありがとう わたしもいる 	私はあなたが幸せです
すっごくすきぃ。	私もすきい
ありがとう改めてまたよろしくね	私の方こそよろしくね
彼氏できました	私も彼氏出来ました
やーん  英語わかんなーい   え 	私も同じって意味よ    
おはようございます	おはよう私は朝からバタバタ
 ω・｀ 	ありがとう私も仲良くするよ 
早速タメで ゆあって呼んでもいい  	うん 私はなんて呼んだらいい 
なにがジワジワ来てるのよww	poisonですよね私の顔面️
22個も食べた	私もっと食べてたかも
有的以尝试私聊。	私聊不了
ちょっと酔った好き	かわいい…私も好き
サクラ 	私はここに居るわ。ずっとアナタの傍に。
ありがとう 嬉しい  	私も絡めて嬉しいよ️
見てみ 自分の誤字w	んえ 私バカだからわかんない
え 好き  	え 私も好き
今日の見た目男の子みたい	私可愛い服着とる
大丈夫 つかれてる 	なんで私が心配されているんだよ 笑 
嫌い	私も
マルゼンスキーさんも可愛いですわ	へッ  私が…  
だいちゅき  	私も  
欲張って倍量にしたらしいwwwwww	倍量www私もやりかねんwwwwww
待つのに疲れた女	私もそれになる予感
6 7 8 11 15 16 18	あんた、私の安定やわ
だってアッガイ大好きですから	私もアッガイあとズゴックも好きです
ブルズで0点出して終了	私もです…
昨日だけで2冊読んでしもた	けび見習って私もたくさん本読む
もう雪はお腹いっぱいです	私もいりません
大好きだし絡みたいから	嬉しすぎる私も大好き
想	私訊約
え 	私オタクじゃないので殴らないでください
抱きつき返す  ´ω｀   	じゃ私は最後に吸い付く   
まあ確かに眠い時間帯だった 笑 	うん笑良い子の私にはきついわ
インスタ移行垢作ろうかな	それは私もお迎え   
 ΦдΦ  3	お疲れ様です私も仕事頑張ります️
自意識過剰も程々にね、、、 	あれ 私だけ対応違う…… 
いれるー   	嬉しい理人来たら私もするね️
ホッ	あくまで私基準ですけどね ´・∀・｀ 
北海道行きたい笑	私ももうすでに行きたい
ねむた祭 開催決定 	おはようございます 私も眠いです
負けだよ	FとJなので私の負けです 
おそよすぎるよ僕はもう仕事中だよ	偉すぎる私も見習います先生
え、会お	私のffおるけど
かわいいしすきだから	私ももかのこと好きだああ 
たしかにそうね	…私もやってみるか……←
テレビの前から動けない  	私もー️片時たりとも見逃せん
というか何を反省すんの 	私から逃げようとしたことです
おぢちゃんって呼びますね️	了解です 私は何て呼んだらいいですか 
自然の摂理	あーちゃんも私と黒砂糖しよ
楽しみだ	私もー️
食べる 	私は美味しくないですよー 
やば	私の脳みそがついてけない
贵阳 	私聊
大好きだから 	嬉しい 私も大好きだああ 
大好きだからぁぁぁぁぁぁ   	私も大好きだあああああうわああああ 
うううう	私も潜るかぁ…
お昼まで走ろ	えらじゃあ私勉強頑張ろ
わたしもおっぱいのことが大好きです 	爆笑、私のあげる 「・ω・ 「ホイ
あの人多分むっつりだから 仕方ない 	言うて私も目の前でハッチ閉めるっていう
つんwwww	じゃあ3日間一人称私でやるかぁw
️️️	私も何か探します ゲス顔 
全てが素敵ですね。	私にはもったいないお言葉
自白てwwww俺はキノコすき 	私は食べれるのと食べれないのがある 
護摩とかよこせ  	私にも分けて……
こいしちゃんだぁ	私の時間 みたいだから来てみたよ
太ももの関節が痛い	私がマッサージします
何も言わんのかい 期待してたのに 	私乙女だから       
いいよ ターぼ手加減しないからな  	私も負けませんよ… 
そうだね最近4時寝が多い	私ーも少しは原因w
悲しすぎる இдஇ 。 	私も寂しい
しおんちゅ 塩人 ですね	私も絡みゼロでブロックされてました。
チェケラ照れてる限界突破ぁ   	wwww何考えてんのやろ私wwww
ヘッダー募集	私のみゆなの️
まぁ、俺の方がおじさんなんで‍	あーみやし私より上か笑
起きた	私、起きたけど、まだゴロゴロ
ねむた祭 開催決定 	私もねむたいですうう 
Capcut 	えっ私もなのにこの差って   
私静岡とおい	私は秋田…え、や、遠い……
おはお      	私寝ちゃってた…おはよ  
笑笑笑笑手抜き最高よん	私の好きな言葉「手抜き」
勉強道具持ってこよ	私も今持ち込んでやってる、笑
最高ですね	私でしこってほしい
ちょっと酔った好き	酔っちゃったのw私も好き
 ´இ﹏இ｀ さみしいよ	私もだそれは
グッズさんへ私のグッズはどこですか。	私4月発送とかありえない聞いてない
はい同じwww神	あなたは私のものです
毎度ふーみん好き	私もしゅき️
東京。東京	私だけ浮いちょる   m
え、疑われててさらに泣いた	私も泣いてる
はーい 	私も会ってみたい 
なんでこんなに㒰立後糸扁たのしいん   	私も今日見ようかな 笑 
緊張する	私も緊張する  楽しみだよ  
ん 	 w私は居なくても誰も困らない 
じゃんじゃん絡みに行くからね 笑	待ち構えてるね 私も絡む  
頑張りましょう	私は解消してきます️
好きだから 	嬉しい 私も好き 
すき	私も好きWEST当てようね
友達をくれ… 	私にもよこせ…
はーい 	私も会ってみたい 
ほたるちゃんありがとう らぶ  	私もらぶ  
もう生きてるのしんどい‥‥	私もだよ
きのう食べた 	お、どうだった 私まだ食べられてない。
仲良くしたいにゃ	私もずッと仲良くしたいですッ 
えりちゃんって呼ぶねー   	はーい 私なんて呼べばいいですかー  
一生忘れない	ありがとっ 私も忘れない 
私がいちばん私をきらいだよ	それは私も自信あるかもです。。。
おはようございますㄟﾟㄋㄟﾟㄋさん	私の名前が日々進化していく
スペース	私が開くの 
好きです	私も好きです
風呂の…	私もそれちょうど見てましたね……
お疲れ様です	最後の方私半目だったかもしれません
とおいなーw	私最後に行ったの18年前w
あたり すげえなぱとこ 	やば。すげえな私
今日は彼とデートです  楽しみます   	私もです‍️
象間がこんな名前に  	私も知らんかったです
嬉しい再会ですね	私も感動して嬉しかったです
今日は遅めのバレンタインつくります 	私にも作ってー 
寝ちゃったwww	大丈夫w私も寝たw
白いブーツね 探す  	私も探す
会ってみたい  	私も会ってみたい 
セシリアで十分な感じですかこれ	私はセシリア出てから使ったことないなぁ
さちゃん もっと仲良くなりたーい	ほんとにそれ私も思ってる
朝ごはん食べた←遅すぎるそして眠い	もあにんおは私もさっき食べた爆笑
もうとっくに惚れてるなぁ	私もよしのに惚れすぎちゃってる
私はいつ発送されるのですか	私も発送されてません は
愛してる	私も
ウエディングピーチが好きだった	  私も好きでしたー   
仲良くしてぇ	私も仲良くしたいですッ 
おはよう眠いよ	おはようサン私はします
英検行ってくる行く準備する	私も今日2次試験www一緒に頑張ろ
カーリング決勝戦観戦中頑張れ🇯🇵	私も看てまーし がんばれ 日本 
ありがとぅー⸜  ॑ᗜ॑  ⸝	私も頑張りますね  
あ、ごめん	私がネタバレを気にしない性格でよかった
ガチ今起きた死ぬ	大丈夫私も今起きた  
設営完了も言えぬままいま	私もでしたうっかり  
会いたい大好き愛してる	会お。私も大好き愛してる
カーリング女子決勝見てる	美人バージョンの私出てます 
お は よ 	おはよーう 早いでしょ私
ほわちゃってタグやってなかった昔	私タグやった事ないなぁ
みんなあいたいな	私もあいたい
NHKの中継義堂アナが一瞬抜かれた	やっぱり 私も思った笑笑
衝撃な事実	私も衝撃よwwww
誰かチェイス教えてくれませんか     	私も知りたい…がんばろ 
愛してる	私も          
おまわりさんこいつです	私もおまわりさんです
明日はあiんiスiテ、ソワレですん	私もソワレです楽しみですね 
えみちゃんすきよ	こんな私でもコマウォ
ろにちゃんってお呼びしますね	私はなんて呼んだらいいですか  
920 いつなの 	私は3月6日 
あざっす頑張ります	私は4連勤の始まり
ちょっと酔った好き	私も好き️
え、聞けなかったー️	私なに聴いてたんだろう
ごめん何にマヨネーズ付けたん w	私にですね…… ｀・ω・´ 
楽しかったよ ありがと	私も楽しかった ありがと 
グッズさんへ私のグッズはどこですか。	私のグッズもどこですか 
もち もっと自発いくね 	私もいく 
その歳でまだ缶蹴りを純粋に楽しめるのか	うん、心は子どもやからね。私も君も。
どうやら教育が必要みたいだな	それを決めるのはゆまるじゃない私自身だ
私服見てみたいww	先に言っておくけど私の私服ダサいぞ 笑
やるならツイキャスとかでいいすか 笑	私は一向に構わん  
親学生     ってなってました  	だよね ww私も読み直して思った笑笑
この時間から日曜出勤… ›´ω ‹ 	私もです 共にがんばりましょ  
ごま降ってきたいっぱい	私、るなよりも早めに死んだ
素直すぎて吹いた	これが私の乞食スタイル。
