黙れコロスゾ	私の彼氏カッケェ
お迎えですよ	ありがとー 私ネプテューヌよろしくね 
ごめん     	私についてるこれはなんなのさ笑笑
きらちゃんって呼ぼうかな️	分かった私はなんて呼べば良い  
オンギャ    産まれる音 	まーじやばいよね、私の絵てんさーい
はあすき目お大事にね	私もすきありがとう
最近続きすぎて泣いてます	私の胸で泣いていいんですよ
我在高雄好想做愛	私訊‍️
あんまいないだろうね	たぶん私くらいだよ
最高だぜぇ           	私も祭りしたいぜい 
私は京都です。是非お迎え待ってます	れいあに来たら私にも来るな…
、、、、、、️ 	ありがとう私も愛してる  
うざいから	あ私が ブロ解してくれ
にゃ	私もそろそろ…
わぁい楽しみ️️お菓子渡すね	やたー 私も渡すね
寝る子は育つ‍️	私のこと見えてる⁇笑笑
ケチャップ派です	私は砂糖醤油みりん派
……ん こっちが選ぶん 	え、これ私が決めるやつ 笑笑
そろそろねますおやすみ  	私も寝る、うん。寝よう。おやすみ 
     ふ、フランちゃん     	冗談にゃ、私も男の子だにゃ 
雨は嫌いです	風太郎さん私も嫌いです️
 ブロックしなきゃ    	闇を祓うつもりか 私は闇か  
w私も思った	だよね 私欲求不満って思ったわ️
待機しとったら誘います 	私もちょっかい出しに行きます   
152もっと欲しい泣	え私それより下だけど   
ゾンビ… 	私は吸血鬼糠星はいいぞおじさん…ゔ
みんなスペースできるようになた  	私はできるっぽい
きぃちゃんって呼ぶね よろしく️	じゃあ私はるいちゃんで よろしくね
88 連射の力ですww	いやぁ、私の実力の無さを痛感します
斜め上の発想 ˇωˇ 	私じゃないと思いつかない 適当
泣きそう、	私も
タメ口禁止だからな敬語な	私、敬語、分からない
付き合おか	私はガチだよ
はい 入れてまふ 	はい 知ってまふ 私も入れてまふ 
正座しながら言ったら許されたね	私は許したよ
外パリパリザクザクチョコレート	完全に私のタイプで草
もらってくれるん  	私なんかで良ければ、、
その意気だ、がんばれ	私っ なんだってやれますっ 
そうiPadと接続できるやつ	いいなぁどんなやつ 私も買う
涙袋ぶくぶくおちんぽ欲しがりフェイス	小林私
ですよね 	私も困っちゃう時あったりするけど… 
グループ引退びっくりした 	私もだよ  
小説の書き方がわからねぇ‥	私も全然わかりません……
そうね	私は小さいし細いですが、頑丈です
嬉しい、、、絡む	私も絡みに行くね
言ってこ️️	これで私も広山楓だね 
ありがとう  頑張って書く	私も頑張ってになるね
3月からダイエット始めようかな️	私もそうします
りあらむ推せる	私とらむちゃかと思ってたまげてた
紺ちゃんって呼ぶね	はーい 私はなんて呼んだらいい 
罪深き推しに幸あれ	私にも幸あれ
もどきかーい   wwwwww	私の愛は高いのだよwww
自分の住んでるとこ気に入ってるんでムリ	私のとこもいいよ
明日、起きれるかな……	頑張れ 私も無理そう
当たったらちょうだい	それ私のセリフなんよ
愛が…愛が深すぎる	私の愛は重いんですよ……
する	待ってる私もします
誰かお話聞いて	私なんかでよければいつでもどうぞー
いやらしく聞こえるわ	w私も思った
おかしい。スペース立ち上げられんな。	私も同じくです
また落ち着いたら連絡する 	私も連絡する   
てんてててーはおくじゅ家かね	てんてててーは私のフレンドさんです️
Xperia	だから私はXperia   
まだ寝ないけど、おやすみなさい  	私もまだ寝ないけどおやすみ
りなちゃんって呼びますね	私はなんとお呼びしたらいいですか
みくは好き でもムリッ	私の胃の中まで愛してほしい
はい お時間合えば突入します 	私も色々済ませて時間作ります 
最高級ブランド米	いや、それは私や
りあちゃんも制作側ね  	あれ私も制作側でしたか  
ちょっと嫁入りしてくる‍️笑笑	私もしてこよwwww
最近カヌレ流行ってるな	最近なのー 私は前から好き 
さぁやさん……とぅき…️	私もちゅきです
やっつぁ	私スペ開くね 
邀你来我的孤寂坐坐	私我兄弟
スヌーピーです…好きなんです…	私も大好き スヌーピー   
じゃすさんがドンキー使うならやるぞ	え、私ドンキー使ったことないけど
まわりリア充ばーかっりぴえん	私が居るやん
私の方が大好きありがとうだよ	いや、私の方が大好き
なにそれw	私もわかりません色んなpt考え中です
ライビュまだ迷ってるんだけどどうしよう	私もさっきやっと申し込んだ
息吸わなきゃいいだけさ	私人間なので……
はせ軍曹と軍曹であります 	私プリキュアになりたい
犯人かよw	私だよww
私も本物だ。	いや違う。私だ。
弱いけど許してもろて	それは私が言いてぇ
RE0から始まる覚醒ハイパー	明日は2「0」日私は行けませんが
繋がってすぐさよならはさみしい w	それは私もさみしい 
特別にゆーなを肩車するよ	え、私重いよ  
え、お前のまねしたんだが	私そんな笑い方したことない
私は4部が好きです	私はじょりーんが好き
ちくび晒したい	大勢には勿体無い 私はだけに
違うわ 私よ  	うるさいわねっ 私のモノよ 
片眉なしは笑うw	その場合私も片眉ねぇからお揃いだな
お話を…したい…っっ	私もお話が・・・したいっ 
頑張って卒業しような	あれ、私が留年するとでも 
うちのモデ空いてますよ… ボソッ 	私で大丈夫ならなりたいです…
PCなら	いいえ、私はマック
僕は低ランなせいか黄色く染まりました	酷い私は真っ赤なのに…
ののタンは   	私は……なんだろ  
俺もそう	じゃあ私の事嫌いだね
お魚苦手	私も青魚は新鮮なのしか食べれない
墨も入れたいし穴もあけたい	墨は私と温泉巡りしてからにしろ
ありがとうがんばるよ️	私も頑張って有名になる
山田涼介 宮近海斗 	宮近なの 私も宮近ー 
ふぁっきゅー	私の彼氏が世界一  
あのね、みんな愛してる	私もたこやきくん愛してゅー
頑張りますよ	ええ。私も頑張るからお互いにね 
気になるね	だよね笑笑私でも分からない笑
時間が時間だしね	私も明日は仕事
僕もやりたい  何も出来ない 	私も何にもできないよ 笑
俺いちばん怖い笑笑	怖い言われても私は聞くよ 笑 
飲めないんだよ	私もあんまり
僕のお姉ちゃん	私のママ
な・・・なんだってー  	私も知らなかったよ    
そうなの、、、、、こわい。たすけて。	助けたいけど私男の子難しい
えへへゲットしちゃった    ︎	私もオタ活せな、、、
予想的中やね	ね 私らの推理は正しかったね
えへへ…   好きだよ…   	私も…   
ちんちんきってみたら 	それより私は首を切りたいところです。
一緒に土に帰りたい	私が2人を掘り出したげる
そうなのww	そうなの私は夜型人間だから www
私だ。	私も本物だ。
出来るねじょじょ出られるね	私は4部が好きです
浮気じゃないよリカ	憂太、私以外の名前出さないで
ほやけんまかすわーあとくそ弱いです	私も弱いから大丈夫 
優勝	うおっしゃ  私もこれしゅき   
また、お前の負けだ。ギガ数増やせ	私は、弱い
アツアツ持っていけば良かったねー	私が食べに行きますー‍️ 笑 
まだまだだよ 行く人はもっと行く  	私は行かないもん
気圧に負けるわたしの頭2days。	やっぱ気圧のせい 私もだよぉ
SAOもリゼロも両方好き笑️	私も笑作品自体は好き
周年まだですぉ 	おたくの定休日と私のお休みかぶってて
おやすみだいすきまた明日	おやすみ 私も大好きです 
俺はもっと頑張るぜ    ´・ω・｀ 	私も頑張るわ…
やったぁぁ 一緒に参戦️	私もるぅあと参戦楽しみ  
あれ、なあちゃんいない 	私は出てないよ 
やだ、嬉し  きも 	私も嬉し  え 
www	私でも出来るから大丈夫️
もうないよ	え、また私のために作ってね    
23時間寝たに見えた冬眠	そのせいで私も23時間寝たのかと思った
美術はオール2です	私美術得意やったわよ
違うんかーい 笑	遠くから眺めていたいの私
そういえば英検準一落ちました かわいい 	私も今度受ける恐ろしいや    
攻めしかない人生	常にははかいこうせんの私
好きすぎたww	私もうい大好き ⑉••⑉ ︎
多分明日にはもっとひどくなってるわ	私も枕におでこぶつけすぎて痛い
チョコ ああ、いくつかはもらったぞ 	いいわね 私も少し貰ったよ 
ホントだねイチゴから クマから 	私ならクマから行きます ¨̮ 
わろたww明日昼から暇だし遊ぶ  	私も昼から暇笑笑
イチゴ大福「お前をみt」 ぱくっ 	餡子「跪け私が王だ」
私でも出来るから大丈夫️	私は出来ないww
色んな手を使って聞いといて  	私では手不足でした‍笑
一蘭すら行ったことないや…	私が連れてってあげるから
寸止め上手な中村さんw	私達はどうすればw
今は佐々木と宮野見てる	え、待って、私も見てる
まじっすか神っすか	そうです私が神なんです
周りの岩本担死んでた	私の周りも笑
いつ空いてる ちなワシ今バカほど暇	私も今暇やる  
ふぇ 	私がのんちゃん全部ね笑
500円ー	一様、私は買えるんだけどね
へへへ 素直じゃないね	私はいつでも素直ですわ
鮨食べたいー	分かる。私は毎日食べたい。
命日命日	そっか死ぬんだ私
もう半年くらいいってないきがする	だいぶやねー私一年単位かもしれん
かわちい	私も可愛いと思う 
秒でしないと答える	私も絶対無理です   
何発殴るんだぁぁぁぁ 	私の事ババア呼ばわりしたから88回
腹立つwwwwwwwww	私は楽しいよ
蝶や花のように大切にします️	w嬉しい  私も大切にするわ  
出遅れた怒られる怖い	罰として私に逢いに来て 
むんちゃん りょーかいです	私はなんとお呼びすれば、、 
いつ私にくれますか 	明日私に行きますね  
あれ 豚汁って白菜入れない…… 	私は入れないです…
あなたじゃない	私以外私じゃないの
みずきたん好き	私の方が好き
ちーちゃんお姉ちゃんみたい大好き 	私もゆるたんずっと妹ちゃん大好きよっ
それは良いこと。暇だから少し構って	お、いいけど、私寝るよ wwww
いや私のが歳上なのですが…    	ん 私だが  
そうかな 	私はそう感じましたにゃ
投資は安めでお願いしたい	私はいつも投資が多くなりやすい
分かってるやんうちらまぶだもんな	マブ過ぎて眩しいよね、私達。
セフィーロ  	私、売ったよ️
お酒は単に飲みたいから飲んでるだけ	私もそうだ
いつか買います	定価じゃなきゃ私は買えない
ドンピシャですね     	つまり私ですね  ←
お願いします タメ全然〇です 	把握です 私もタメ全然大丈夫ですー 
優勝するなにゅさん集	私の友達頭おかしいやつばっかで最高
誰も来ねぇからだよ   	私が来た 
同級生に言われました	私は好き
りゅがのちょい八重歯かわよ	私も八重歯だにょん
22日にPCR検査行かなくては←	私も行かなきゃ
俺が勝つ	いーや私だね
も好きです️	私は断然派
りんはあく  	私はなんて呼べばいいかな 
もんすたーのむ  	私モンスター嫌いおいしくない
はるか大好きだからやっぱ安定だなー	うわぁー私のこと大好きじゃん
いいな…私人様の見たいんだよ…	だって私はみぃちゃんのが好きなんだ 
スペース不具合 	私だけかと思た 
おやすみっ  ´ ω ｀ 	おやすみー 私はモーちょい起きとく
私もシーズン46に出してくれって	あー、キャスト私だけなだよね
お付き合い ﾟ ﾟ  はぅ 	私もお付き合いに行きたいですwww
明日早起きだけど、ANNは、聞きたい 	私も結局起きてる
やっぱ今日どこもスペース調子悪いんかな	私標示すらされてないよ、、w
ええムスメやぁー  ´  ＼ 	いや、私は特に何も… 苦笑 
お腹すいた  ›´ω ‹」∠  	私を食べてください    www
リプくれるみゆうちゃん優しくて好き	ありがとう⸜︎⸝‍私も好きよ  
たこちゃん顔がいいからしょうがない	私らのちの顔面くそすき
それは可愛い普通に見たい	ただの私の願望って話でもする w
お尻叩くと興奮するタイプです	私も趣味が合う 
両方とも好き	この二人は私も大好きです。
待って開始できないwwww	私が開く 
DM行けない ´ ω ｀ 	じゃあ私から行きますー️
渡辺温斗いかん男や最高	私の英才教育です
最近供給多すぎて追いつけてない	私もなの
キャスかくかくしてる私だけかな	私もかくかくしてる…
年齢非公開	でも私は知っている笑笑
ホントそれwwwww楽しかったwwww	私も楽しかったでwwwww
スペース表示されないの俺だけ 	私も
ダウト	実は私女の子なの抱いて   
1つには絞れない️6 8 9で	ありがとう私も同じー
え 	私のもう一個の方のリプ見てw
タイムを分割って…… ˊᵕˋ	そのやり方で行くと私のタイムは1秒です
スペースこんやんだれも	バグるんだが私
おい玉緒くんは私のものよっ 	違うわ 私よ  
なかったらないてまうっw	私寝る時聞いてたから寂しい笑笑笑
メーシズ推しです	え 私もなんです 
多分わりと黒歴史が詰まってるw	私にぴったりだね   
え、なんか心臓もらったんだけど…	私のスペアだったモノだから大事にしてね
ありがとうって 	私もシーズン46に出してくれって
ですてぃにー	言えることはそれだけ。さすが私たち。
アクキーって何個買うのが普通なの…  	私はいつも1個 
Twitterバグっとる	私だけじゃない  
遠視なんです許してください	私は近視です    もー
好きすぎた	え私もすき
はるののことじゃないよー	いや私以外にいなくて草
ただしくはいけど、勇気がないだね	しなないでよ 死んだら私も死ぬ
ねえせおちゃんと遠いのやだ   	私もやだぁぁあ
いつも通りなので計画的にですねww	私はいつもの如く散財してきます  
ほんとだよさくをいじめて	私にふるなよ w
ありがとう	私もあまにちゃん大好きだよ 
おめでとうしーちゃん すき 	みくちゃんありがとう私もすき 
え。嬉しすぎる大好き 	私のが嬉しいよお    
恥じゃないから大丈夫やで ˘ω˘ 	私には恥なんですけどぉ  
是非とも交換してほしい	私も交換していただきたい
ライバルやん	おい玉緒くんは私のものよっ 
ふうちゃんもだよw	私出来ないから笑
なんでそうなっちゃうのという意味  	これは私としろんさんの絆を深めるもの
もちろんそのつもり 	私も疲れたなぁー
まじかwww何センチだと思ってた w	私よりは大きいと…   ww
その2人似てるよねー	私の好みがバレましたな  ω＼ 
今日セーラー服着ました。	私の制服セーラー服だよ
まずい…ちょっと眠たい…	私もそろそろいや、がんばる
全然いいよ。私の苗字なんか捨てていいよ	私本気だからインスタ交換しない 
Twitter辞める辞める詐欺します	私みたいだ
やったポーは何歳   	私19  
こちらこそ	私のことはよるちゃんって呼んで
マカえん6月のやついくよ	え  私も行くんだが
キムフェンかわちぃむり	なみしゃんと私だね また言ってる 
晒すなアホ	アホ 私 
わぁーぉ………	私、優しいですよね 
レモンちゃんになったのね	おばおちゃんと私も呼ばせてもらうね 
ヤりたいんでしょ 私もですよ。	私もでぇーす
うん 絡みに行くねん  	私も行く  
なぞすぎwwwwもう1位なはずだわw	私に任せなさい だれww 
なんて付けて欲しい	これ    私もこれでつける 
欲張るなら、グリべになりたい。	私もイエベだからブルベになりたい
オールだオールー今日はオールじゃ	私もオールする  
明日はね、マッサージに行くの	羨ましい。私も体が痛いdeath 
最近絡めて1番嬉しかった	私も 
私鍵からフォロー行くね 	了解 私もフォローした 
ほんとそれな……	私達も頑張ろうね…
出来てない	私のに入れるのかなっ  
いや、おわったくね	私のは出てこんよw
妹不仲すぎて‍‍‍	じゃあ私が妹になります  
凍結されてない 	私普通にフォロー出来てるんだけどな 
好き	私もこの歌すごい好きで御座候
すきだよ	私も好きだよォ⸜ ˙̦꒳˙̦ ⸝ 
明日作るさえさんもつくろ 	私も作ります
セフレ募集しちゃいます	そして私はあなたを探しています
好き 	私も好き 
しのさんはお姉さんだと言うことです  	お姉さんは私よ  
一緒ですね 同じ地区だったりして笑	えっ、えっ️私、大阪よ️
1番厳しくて草	私の江成和己への愛舐めんで
っっっっ好きィィ……	ゔっ私も
ちーちゃん よろしくお願いします 	ここでは私が先輩です
もう手遅れだよ	藤井風が言うな私はまだ間に合う
え、薄紫   グレーじゃね 	色盲かもしれない私
さやちが2人いる	私ごくあくにんじゃないw  
タワレコ行きたい	私も
今いってきた	ありがとー  私もフォローした 
草………ん 私って言ってる ・ ・  	気分によって変わるけど基本私
一瞬聞こえた雑音  ꒪꒫꒪ チーン	私も一瞬だけガサゴソ音聞こえた  
返さへんのあんたやん	私返信遅いって言ってるもーん
なっちゃぁぁぁぁぁんすき	嬉しいー   私もだいすき
食べた ๑•̀ㅂ•́ و✧︎	私の分は   
pm	私聊我 
ひな助画伯の腕の見せどころだね 	そうなの さすが私って感じでしょ
さすがに画面に度見したwwwwwwww	私は冗談だと思ったwww
おほほ	あ、ちっちと同類です私
今日は出たよ	私も出た
九九言えるから俺の方が上だし 	私今微分積分できるようになったから勝ち
アサヒスーパードライ飲む	私はマルエフ派です 
直撃だと  	私の豆腐メンタルが大破するwww
RJがはしゃいでる	私もはしゃいでる
名案…    大好き… 	私も…     
私も、買おう️	買えたかな 私2杯も飲みました
安定すぎて異論なし 	だよねー     私が1番ー   
ポにします   	私はなんて呼べばいいですか️
ん。ありがとうマスター︎︎	そそ、私も頼りなさいー  えへん
顔好き	私のセリフ
嘘、27がありました	奇遇ですね私もです
自分のことだよ 	私 もしかして 
お 楽しみです 	私も楽しみですー いえあ 
私は黙る派	私も絶対黙る声キモイもん
週一で飲むペースに戻そうかな	私も誘ってや
オイ       俺も出してません	またやるか  私は住所書く編だが 
いないと思います	正解です私の近くにはいい人がいません
めちゃめちゃ楽しかったよ	私も行きたい東京
なるほど最初からそう言えや美人	くっふふ可愛いじゃん 私たち
ならヨシ 	私もなんか描くか…
すき 	私は髪下ろしてるこっちゃんが大好き
最近ひんぬーのほうが好きかも 	私だね
推されたい	いやいや、私の推し方気持ちわるいよ
はぁすきです	私も          
今、生で聴いてきた	さすが   私も生で聴きたいなぁ 
うれしいっ     	私もっ     殴
垢作ったから誰でもどうぞ	私が1番
話せないの 	話せる 私今話してる
する	じゃあ私もしとこっかな、、笑
会った時タメ口で喋れるようにしまーす	私も
そしたら私攻めになるけどおけ 	おけおけ、そうなるると私は受k…
ごめん全然気づかなかったwww	私のこと嫌いなんだ…
好きな歌の1つw	私も好きw
私も1個再試	私4つ 
はなおすきです	私もよく見る 
したいから…	私はしたくないですね   
じゃなかったか笑可愛い思ったよー 	私なんて全然全然だけどありがとう
だんしかもーん 	私のタイプの人ー
ありがとうございます	私も早くゲットできるように頑張りますw
いーや。たまには休むよ	そっか、私も来週後半は全休になる予定
とまった 	私じゃなくてさおみさんwwww
明日フルーツ大福買いに行こ	私も見てたら食べたくなった️
歌上手くないので聴く専門で	んじゃ私歌います  
いや先に手出したのそっちやねん	私はただお守りしてあげようと
もうやだ、しにたい	私も、死にたいです
一緒にするならいいよ	私もう布団であと数分で寝る人
深い絶望感を覚えた…	私のリノや
wwwまあ、ゆっくり寝てくださいw	私も今日はゆっくり寝るww
僕は血糖値が   w	私は血圧が……w
タキは2ケースしかないなぁ  ボソッ…	 私も2ケースだけですよ 
どれ 	今、私たちの学校はってやつ
ぼくは、欲しいですねー 	私も欲しいです
チビさんのクラウン増やさないでー	私とちびさんお揃いです
でもあんまり覚えてないな	内容うっすい私たちの会話
どの時の池亀がいい 	私のLINEのアイコンか爆イケ池亀
了解しました 	私はなんとお呼びしたら良いですか 
どっちでやる笑	私でやるか 
めっちゃ歌うね 	私はひたすら歌っちゃう人‍️
今度ゲームしよー	やろやろ 私弱いけど…
ヤバないですwww	私は蹴るのだけ左利きです←
はら 生存が危ういやつなのか	もしもの時は私が人工呼吸で助けるね←
脱NUMA 	私はぽんこさんに沼ってる
何も可愛くない…嘘つき	私が言ったんじゃないもん
わたくしの発送メール様はどこですか	私の発送メールも迷子だw
いや、僕本当弱いのですよwww	私は職業柄強いです ˙꒳˙ b
小鳥遊も愛人欲しい	私よ   笑
あるある	だよね私だけじゃなかった
そんなことある www	私もびっくりしたw
出遅れたぜ…	景品は私からの愛してる
安倍なんか支持した覚えは無いぞ	私も そんな覚えひとっつもありません。
2 3 9 10 16   	おぉ 私は23912かな
妹の髪の毛乾かすの割と楽しいから好き	私の長い髪の毛も乾かしてほしい
好无聊呀 有线上玩吗 	私
リリのお店に行ってみたい 切実 	りーこテイクアウトします。私が。
いつか描く	私も神谷のツインテ垢抜け作戦するわ
楽しいです 	何よりです私も楽しい週末にします
予測変換がこれとは情けない	私もあるよ大丈夫  ω  و
そうなんだよね、怖い…	私が守る……
盗撮すみません	私もゆたくん盗撮してるので大丈夫です
それは無いから安心して	あれ、私の目がおかしい 
あーうん義理チョコ増えて困惑中。	私食べ切った
かわいいWWWWWWWWW	私のウマ娘
ただいまー 2回目 	あれ 私2回もお迎えしてた 
けみおすき	私も
嬉しいあとでDM行く  	私も嬉しい了解です     
ビールで我慢。	私はZONEだ
変な人からフォローくる	私のとこも同じそんな人は即ブロ解する
撮ろ 会おう。 距離が… 	私関東 ・ ・  
こ、後部座席の人裏山スギちゃん	私は地獄
超常識	私は永遠のおうすけ推しなので。
きゃあありがとう	私は死を迎えたよ
一日一個送る  ω  	回答しよう私
見ないと呪われます、私に 私かい 	私も一緒に呪います
スペース調子悪いですねw	私はスペース表示されません
ある、だよねっ… 	私にあると思っているのか…
やはり鳥取県がベストな県だなと。	私もつくづくそう思います。
悠月はヤダ  	私が許さない。
ゲイツ ジョーカー難民です	ハッハッハー私もだ   ・ω・´ 
誰の最推し 僕の はまねこさんの 	私の   
