鹿児島から配達してください   	それは私です   無理です    
キルフェボン好きです。	私も好きですめちゃ美味しい
せなに嫉妬してるかもーって思った…	私に嫉妬するん  なぜに 笑
そして安定のくそ早く着くやーつ	私はトイレ列にいますよww
ちょっと酔った好き	私も 
好きー	私も次はどこの国か楽しみ
もち	じゃあ私もそうしよっかな
確実に太ったので明日からダイエットします	私も毎日そう思っています
次に会ったら癒してもらおかな w	私にゃ大したことはできないけどねw
しるみさんのご指示通り開催できました	私も探さんなんw
こっちは、バラバラだからね…起床時間が	私はいつもアラームを掛けてるから   
もっと可愛がられる	じゅんさん私も可愛がられたい 
まーちゃんのこと待ってんだよ	私もっと浮上しなきゃ………
どした 	私がききたいわw
子どもだからできる技‍️	私がやったらただの気持ち悪い人w
フォトセ何セット買えばええんや……	私と同じこと考えてて笑ったw
彼氏に会いに行きたくない…	私もよ
ヘブバンどう 面白い 	私は好きよ 
おでめとう	私も金玉すき
楽しみにしててね しないけど 	楽しみにしてる 私もしないけど 
なんか誰かに呼ばれた気がしたが	私かも
仲良くしてください	私と繋がりますか 
腹減ったな	私は今から寝るぞ 
了解です ひよさんって呼びます 	私はなんとお呼びすればいいでしょうか 
Kaoritaさん好き。	きゃーっ私もわんださんすきー 
右です	私も右です 笑
あと休みが足りない笑	休みか私も足りないww
お腹いたくって死	私も…   トイレと友達 
ちっこちゃんありがとー	良かった私も嬉しい️
すき	私も大好きですっ ᐟ ᐟ
私のコスプレデビュー同人イベントだし	私は高校の学祭ーっ 
信頼を積み上げていきます	ろくさん 私もコツコツ積みます  
おはりんりん無限	私も欲しいよ描ききる気持ち
今声死んでるけどいける  は	まて、私も寝起きだからwwwwwww
おっしゃあああああ 楽しみ	私も楽しみ   
ちょっと酔った好き	私もすき  
天了解した	私はなんてよぼ
マカロン食いたい	私も食べたい  ´﹃｀  
了解	私はなんてよぼ
あああああありんすきいい	私も大好き
最近、ミスド食べてないなぁ️	私も久々に食べました
大丈夫ですか 	ドアも私も痛手を負いました笑
人間性ピカピカになりたい	みやこさん、私たち一緒に
The散財	いや私は貯めるで絶対に。絶対
なんだよ ・ ・ 	私ちゃんとこのあとあうねんしゅうくんに
ぜひぜひ️です	ありがとう マの裏が私 
ダイナモ超むずくて使える気しないですw	私も使えないです
通知つけた 	やった 私もつけてる  
綺麗なものが見たい	私の心
早稲田ツアー開いて	実は、私もやりたいと思っていました
3分でこっちの駅方面にきて	沙耶伽さんの尻私叩けない
ボイメ    	ならば私の声出しを聞いて  w
ナイス	私が見に一回の  
むくみやばい	私もWWWWWWWW
私はエリンギ	「私はえのきかなぁ」
え るか、いつ消されたの 	私は消されてない 
無音wwww	私がこれやると何も無くなるwwwwww
うんうんなるべく自発いくね	私も 
猫ちゃんもぐっすり	私の腰を破壊しようとしてる猫ちゃん
うちもたまにある 笑 	私だけじゃなかった ﾟ∀ﾟ  
元々入れてるにょん 	いやうれし私も通知入れる 
今日の目標空転・滑走を一回もしない。	私には無理だ
逢坂さん言うわすれてた	私ですか 
眠くないのであります  ┐「ε   	なんで私は今起きた
じゃあ俺があげますね 	私手強いですよ 
俺も会いたい 早く 	私が飛ぶまで待ってて
どうしたのですか 	私のいいね欄に詳細があります。
ホーイ ∩´∀ ∩  ﾟ	私の好きなキャラ  
いいねのハート️横の↓	私には見えません
あ、キリヲ先輩も少ないです乙	私のキリヲ先輩ぃ… 
ほんとに 	   私そんなこと言ってた    
いたっ 嬉しいだいすき	やたやた  私も大好き  
がんばって行きます ᐟ ᐟ ᐟ	ありがと ᐟ ᐟ私もがんばるっ
 っ ヮ c ワア	私の得意科目は  
おぉ いよいよ  	私やないねんww
楽しかた   チャーもっと練習する	私も頑張る️‍
扇風機を投げる人もいるらしいよ	タピオカ「私じゃん‥」
自発頑張ります	私も頑張ります
今日ごるたいしんや誘ってくださいぷぷぷ	今度私とも行こうね
電気代が今までで1番高い️	私、1人なのにめっちゃ高いですよぉ…
ここねいいこと言うのすき	私もすきよ
サクラ お前か 	私よ サスケくん 
お金が貯まらないのはこれかな	私もですよ。
おは	おはぴょ 仕事 私日勤 
会えるの楽しみにしてるよ	私もー  
はらへった	私のオムライス食べる 
先週から探していたもの見つけた	ふふ私もスッキリ amp おぉー
 ˘ω˘ ふぅー  	流石私の子供 ˘꒳˘ 
チュチュ	また私の知らない間に新しいキャラが…
きたきゅうやで	さすが私
寝起きは元気にいかんと死ぬ	寝起きから死んでる私は
りほちゃん了解です️	私はなんとお呼びしたらいいですか 
朝からぱにゃさん面白い。	私は朝から誤字したんか 恐怖 
仕事、行くわ	私も行ってきまーす️
運だからww	じゃあただ私の運が悪いってことでw
清掃員東海オンエア見てる率高くてだいすき	私たまに見てる  
鍵つけるか悩む    	わかる私も悩み中ㅠ ㅠ
8位だもっと上目指す	私の中ではとっくに上だけど️
ちょっぴり二日酔いです	私もちょっぴり二日酔いです
私もかむいレイズに5万票	私はしなレイズに10万票
ガチでベースやろう	私は何すればええんや
自然とですかね	つまり私は不自然な存在…  
合コンしたことないけどそうなんか。	まぁ私もしたことないんでw
ご」んすき	私もご」んすき
たのちい	私もやりたい
さのさんから加入申請が届いた気がした	   私  
零花早起きしました	残念私の方が早い
ほんとにりとすきなんだが	私もがちでういちゃん愛してる
緊張しない方法ありますか	私も教えて欲しいです
眠たいねー…	私は、全然眠たくは、ないよ
もはや公式も顔負け	私来るより先に誰にいいねされてんのw
いっしょにはいろー	私汚いよ笑笑
する   積極的に絡みに行くね	私も絡んじゃう     笑
石川にもゆで太郎があったとは 	私も知らなかった、ここ一店だけみたい。
えー家一人のことない 	あるけど私がむりかな。ちょっとね笑
おやすみ大好き愛してる	おはよう私も
ぱむちゃんとはいつか会う予定	なんそれ嬉しい、私も絶対会いたい
だる絡みさせてくれる人と繋がりたい  	私じゃん
ねぇ、グッズこない。遅くない、 	大丈夫ww私なんか4月だよww
すき	私こそです 
養いたい	うわ、いいなー。ついでにいい 私も
ずっと起きてた	私の知る限りの最長記録だ
話すのが下手すぎる   、頑張らねぇと	それは私もだから大丈夫 
火曜了解 休みやから集合早め可能 	私が早め無理だわ 笑先始めてて 
起きんの早くね  笑おはあり 	私も、今起きた感じ 笑
仕事やろ 頑張って	私は休みやけどな
かぱう    	絶対私のマクロかぱうだったし
はぁ。今日めっちゃ楽しかったなぁ。。	私も楽しかったです。
全然許されるよ笑	でもね、私のにゃあは需要ない気がする 
ちょっと酔った好き	お疲れ様 私も好き
ありがとう	一緒だ私も狭い所恐怖症
じゃあ貸すのでやってみてくださいw	私には無理ですw
ほんとですか	私は漏れないわ
おいらは、老眼が始まりました	私はもう数年前から老眼が…笑
サムネ誰ですか…	私です
大好き 	私も大好き
降る量が違いますわね	私の住んでる地域は少ない方ですけどね 
いつも思うんですけど、のざはるさんすごい	私もそう思います 
ロコがタイツ脱げなくなってしまう	私の前でしか脱がないから
味方もわろてて更にわろてたwww	撃たれて死んでも私やったら許すわww
猫っ毛くせっ毛なんです	私も伸ばしていた頃は前髪がくるんって
フェアリーさんいつもありがとう	私の方こそいつもありがとう️
わ      以外といいね	私も慣れるまで時間かかりそw
どこが 笑	私にがてなんよ
私からも送っとく	わかった 私も送るね 
それ、ちょっと遅くていいのに起きた	私は休みだから何時でも
カラオケ曲募なんかあれば	泥の分際で私だけの大切を奪おうだなんて
すき	私も大好きです  
らぶ	私もLove
はらへった	私もお腹すいたなんか食べましょ  
何気それが好き笑	私も好き
3回目、モデルナだよ 	取れないから、私もモデルなにしようかな
すごい満足して帰ってきました  	私も今度行ってみようかな️
らゔ	私もだよん
おはよう今日は仕事	私も仕事ゆるよろです
自分はそうならないように気をつけます。	私もそうしますね
売国奴はだいたい、顔面が汚い。	私も汚いです 笑 
そなの  笑	私は眉毛も無かった笑
えっ  私…  	私ネーミングセンスがないの…
え 何で仕事え 	私もです
爽️美味しいよね	うん、私、大好きよ️
クマだけ頑張って隠しました笑笑	私も塗り塗りしてきた
ねぼう	はむくまさんおはよ 私も寝坊…
あんさつきょしつ観てる	懐かしい 私もまた見直そうかな
冬眠したい	寒いですしね、私も冬眠したいですw
さてちゃん決めていいよ… 	えっ  私…  
 ´    アーン	私のおおおおお  
がなりてんちゃい。だいちゅき。	ありがとう   私も大好き 
初心者みたいな動きしてた	ひぇ……私の知ってる初心者と違う… 
そんなに気負わなくていいんだよ……	いいんですよ、、全て私のせいなので
ハマフグは人気ないのか 。	私ハマフグ大好きです        
おはようございます┏〇ﾞ	私さんおはようございます
あ。今から寝ますっ笑	私も寝るわ
ぜっっっったいにやだね	じゃあ私もやーめた
札幌でぜひお会いしたいです️	是非私もお会いしたいです️
やっばいね オールしちゃったよ 	すご 私オールできたことない 
戦争です	あ、私、徳川家康なので、、、、、、
分かんない…w	祀翠さんと私は友達    
よし、オフトゥンから出る  3    	えらい、私はまだ出ない
つーしんせいげんかかってる	私もおかしい
大失敗しました笑	やってしまいますよね私もたまに…
30年前だったら見せれた 	私はダメだ
ちょっと酔った好き	お疲れ様 私も好き 
今晩から吹雪か。休みで良かった。	私は今週除雪当番です…
かわいい	私も悪を成敗したいのにどうして…
やば…バレンタインのイベントいつまでだ	私もしてないんだな  
久々6桁ゴールドいったよー 	私も最近やっと貯めた
ありがと    大好きだよ	私も大好き
慣れよなれwww	私甘えてもキモイだけ 
日時ってものを知りません	私達生まれる所からやり直そ
やっとつながりました	私もいけました️参加決定
黒い服がないんだなあ	私も全然黒じゃないので大丈夫ですよ️
あれから寝ずにまだ映画観てる	私は二度寝に入らせて頂きますわよ
これめっちゃ良い 	でしょー 私もお気に入り笑
やるかぁ 諦めるなんて自分らしくない 	私も٩   ۶
いらねぇww	私はほしいです
でも9多いねん……	だから私はハンター専
木曜から 今日で3日目です	えー お疲れ様  私たち明日からだ笑笑
まじかよ貶してないのか…その顔で  	私のアイコン貶してね  
はっ   ∀  …	私が当てる側になってるやん笑笑
え、、、、	みんなで私の慰め会しよ
あの世から戻ってこれません	私も…あの世でもよろしくやで
すき	私も大好きです  
れいだけ   	私だけ  
サクラ 	私はここに居るわ。ずっとアナタの傍に。
この垢の通知全部消えたんだけどどした	あら 私ははじめ開けなかった…
でも当てたらゆきに されるww	私が出てたら さない 
おはよーおやすみいいいい	私はねません⸜  ॑꒳॑  ⸝
Mioさんは『ミオ』を覚えたキリッ	イオと聞くとミオで反応する私です 笑 
え高くない高くないw	私もうやばい事になってるwwww
SS画像もらっていい  w	私ので良ければどんどんもらって
早起き	私はオールだ
はい発酵の方が好きDes	交互に買う私です
ずっと友達するする	私もです  
おはよー	おはよう。私も支度しようっと…
Nandeska Baka	私はわからない
もうタグもするつもりないしね	私もやらない
りさはずっと通知入れてる 	私もみくりはずっと入れてる 
知りません教えてください	むしろ私が知りたいのです ˇωˇ 
ちょっとまって、ペンギン	私たちのための診断よ  
春ですなぁ	私も春来ないかなぁ
わりと低くない  	私が 
まながなかったら僕はどうなる w	大丈夫や、私よりあるとおもうぞ w
いつかリアルに会いたいね 	いつかね私大阪ですけどもw
そゆことだよね  	それを見て過疎だな…って思い込む私達
ももさんに会うために続けてるんです	え⁈なんと️私も頑張るぅ
アレ 	私の母親は反面教師なので
 呼ばれた気がした 	ああ、私自身のお話っすよw
そうなの    	私の予想だよ 
や、ヤッター 肉まん当たったー	私も先日当たって速攻交換したよw
今日のコーデも好き  	私も️今日のコーデ好きです
おまえもずんだになるんだよ 	いえ、私は結構です ˘ω˘ 
結局20個できたねww預言者か	そうです。私が預言者です
撮りたい	私も撮りたい
たぶんそこ インスタで発見した	私もここ行きたい  
あ、わくわく流しちゃった	私も癖で打とうとしてた…w
お腹空いたよ何食べよかな	私
実は今の私の眠気も	私に丸っとぶん投げちゃったんですね  
 えっちなことしたい	私もしたいです
絵心を僕にくださいw	私も絵心はありませんw
親父が痛風なので自分も疑われました	私はつま先意外に肘に来ました
ねえ、愛してるよ	私も愛してる 
ズームした後に「ふぅん」って言いました	私はわぁおって言いました
おじさんとは普通いやでしょ	私ぴちぴちの若人なんですけど   
にゃん️  	嫉妬私も書いて
おはようもう一回寝ます。お休み	私も、もう一回寝てみましょうかね…。
DMで敬語なの可愛いどっちでも可愛い	私タメー
ダル絡みするわん‍	ありがとー  私もする   
じーん。って読んでる。私は。	私もジーンだと思ってます 現在進行形
厄年モード突入	私、前厄やわwww
たまにですね      	私は毎日飲んでます
日本語なのは知ってるよ 笑	私の日本語が悪い、と
眠気が来ん・・・ 	あらま、私は眠くて眠くて
おはようございます 	あ、私の寝落ち初めて断った人だ
え、何歳だと思われてたの  	絶対私より年上だと思ってた
さて蒸されにでも行きますか️️	私も朝ウナ
ひぐらし見始めちゃった…	私1個も観たことない感想は
私も既にポチり未遂 赤黒で欲しい	おなじく。私はセカンドで、、、
すき	私も大好きです  
にちようしゅっきんー。	私もです。お互いがんばりましょー
明日サクラグッズ漁ります 笑 	私も色々漁ります笑
しおりちゃんと会いたい	私も  けいくんに会いたい 
11かな	そーなんですか私はあまりしないなぁ笑
5時半起きでずっと勉強してるよー笑笑	え私3時半おきww
wwwwwガチだったwwwww	いつでも私は本気です    
なかった 	私耳昨日に忘れてきたかもしれん
くろさん  気をつけます 	のんさん、私も含め気をつけましょう️
こんな現金そのまま届くんですね	そうなんです私もびっくりです
存在しないがマイライフってなに  笑	私は先に死んでおくべきだったのだ…
え、みほちこんな早起きの人間だっけ 	私5時から起きてた
いや、あたおかしかいないよ	まじで 私と同じやん ´•౪•  
うっ   ふう ˘ω˘  笑	私は今、実用書を描いております
あと10分。TVの前で待機中 	マキさんおはよ 私も起きたー
みんなポケモンの中刀剣乱舞買おうかなぁ	私も買おうか悩んでる
あなたならやりそうで 	私はやらないかな
なんで私望ちゃん降りたんだろう    	それは私もずっと気になってた
嫌だ 洗脳されたくない 	お前は私に洗脳される運命なんだよ
wwwwwwwww	私大人しく帰った 
タコみたいだねw	私タコだわw
可愛いお口見えた	可愛とか言われたら調子乗っちゃうよ私
高須行ってくる	私も一緒に頼むww
カラフルいいよね白雪姫すき	白雪姫いいよね私も好き
同い年だちなみに2回別れた	私は1回別れて復縁してたわ
1ミリも眠たくないのだが	私いま起きましたよ
アレですねぇ	私もそうしようかな
なほちゃんおはよ	おはよ私は名古屋行ってくるよ
まぶちゃんとなぁーちゃんが起きてた 	えぐいwww私も起きてたけど  
きみのことがすき	私もぬきくんのこと好き だーいすき  
なんなんこの異常なまでの眠さは、、	実は今の私の眠気も
うんー   みちゃんは居たりする 	私はジャニーズ  
下次到你請我食反燒賣ovo	呢啲要自私食
ファミチキ食べよう	私ファミチキでごはん食べれる派
おっぱいがほしい【定期】	私もです ´・ω・｀ 
キャンプじたいしていること	私も強く強くそう思います
おぬしも豪遊	私は違います
今日はリバイスの日	私もリバイスはリアタイ
幸せもんじゃあ   	私もハッピーだぜ…ᶫᵒᵛᵉˊᵕˋ
早っ️こちらも砂時計です   	前回は私も砂時計でしたよ 
使いやすいですか 	私は使いやすいと思いました
わしおきたてやもんw眠くないよー	あー笑私と真逆ですね笑
逆じゃないか w	私のお布団と喋ってみな 
いいねー生しらす丼食べたい	一緒にね。私は生は無理だけど
僕なんて家ではゴリラ呼ばわりデス	私ゴリラ大好きですよ
性欲バグってる、、疲れた 笑 	私ともお手合わせお願いします
車も少ないしほんとまったり	私も夜中や朝方のお散歩好きだよ
のりたい・・・・。	私が乗ったのはひのとり68列車
美味しい  この系のラーメン好き 	私も大好き こので育ったようなもん←
引き続き断酒です	私もしばらく飲みません。
いまから  	ご自由にどうぞ私はする
あwまたやっちゃった	まっ、私も誤字っちゃうことあるけど笑
めっちゃ褒め言葉やで	るな私の事大好きだもんね知ってるんふ
むり ゆるさん 	じゃあ私もこまゆるさん 
でも私と結婚してるからごめんね️	あれ 私も結婚してるけど️
お迎え気づいてー めっちゃ厳選した	わーいなんで私もお迎えきてくれたの
え、ねぇ声全く聞こえないのえるだけ 	私も聞こえないことが度々ある
チョコミントはコンビニで知ったぜぇ 	そう チョコミント  私もハマってた
カレンさんと撮ってみたい	アルカさん私も一緒に撮りたいです
風と雪あさ	と私
やったあ 	でも私男だけど大丈夫 
あおしまだあぁぁ 	私らの頃はいじわるばあさんでしたね。
軽くホワイトアウトしとるやんけ	呼んだ …って私じゃないのね。
笑う	一度私に会ってから言って欲しいナ  
もちろんよ	私もこのクエストうけてみたい 笑 
忘れてないよ️	 私が 無理です
え	私
おはよーおはよー 今から寝る 	私も今から寝る
北部找音樂女同樂私訊	私
絡む 	ひーちゃんRTありがと 私も絡む 
りょうかいです	私はなんとお呼びしたらいいですか 
あもういっその事日の出見ようかな	私は見たくても大雨です
早い時間に寝落ちしちゃったから    	荒野しよ 笑私もさっき起きたわ︎
すき	私もだいすき 
それも草	私の彼氏嫉妬しなさそうなんだもん笑
運転席の後ろがいちばん安全だよ	じゃあ私れあの膝の上で
録音用のスマホにつけるマイクほしー	私もほしー
早起きしたのに雨かもう少し寝よ	私もお米炊いて二度寝中ですわ
そーなん 笑笑それもうするしか	だから私もめちゃめちゃしてる 
  ┐アセアセ「ε   	  ┐私は今起きた「ε   
現地にごもりのカベイラはなんなんですか 	それはカベイラ使いたての時の私
一回起きちゃうともうね笑	私も早起きやで
女の子に生まれ変わったら考えます	どんな私でも愛しておくれめんす
2人分の睡眠時間だから… 	私の睡眠時間あげるから…
マジですか 笑 頑張って作らなきゃ	私も交換する本作らなきゃ 
しごおわひまぼ	私とあそばないの 
ちょっと酔った好き	かわいい 私もすき 
なんか楽になれる薬とかないの	私もそれが欲しい
ግብረሰዶማዊነኝ	私はレズです
るとかまちょな日なん今日	昨日からだよ私のわんくん
え  なんで一緒なの    	私時間出来るだけ短いやつ選んだからかな
しごわっ 	お疲れ様ですです私も早朝勤明けです
俺酒強すぎるんだよなぁw	私も強すぎるからなー
萎えるなぁ笑笑	私も嫌だ
ってか9時から仕事なら寝よう	おやすみなさい…私も…眠いです…すー…
BeProud やっぱり好き	私も好きです
え、一緒にいる  逆にいいの  	私でいいなら  
は私の手札に	フィーナは私と  ´﹃｀  
おはよ。とみせかけておやすみ。	私今起きた 笑
見たことない世界	私の経験してない世界
それ明晰夢ちゃう だとしたら特殊能力よ	え、私特殊能力あったの  えっへへ
春日亭にいきたいです	どこですかそこは、私も行きたいです
エビチリたまに食べたくなる	私もですね
有小哥哥來認識嗎密我秒回	私你了
잠이안오다	私もだよ。。。
ちょっと酔った好き	かわいw私も好きー 
なんか胸熱️⌒ෆ 。	私もまたみんなの傍に入れるのが嬉しい 
なんでも  なのちゃんとかかな  笑	了解私けいすけって呼んで
取れる気しない	私も無理ぴ ᐛ و
へへ……	私が寝てました…申し訳…
寝なさいサルより	ぽめえもどうぞくか ちなみに私寝起き
みんなまだ寝てるね	私が寝てないだけさ
なんで彼氏いないの モテそうじゃん	私が知りたい ᐛ 
ありがとう、ダイスキだよ️	私も大好きです 
名古屋についたぞお     	私も着いたよぉぉぉぉ    
きょきょきょ許さナイ	どうして私が答えなきゃならないの。
世界一の難問は人との距離のとり方	ガオさん私にとっても、それは難問
にんにんかんさいこないかな	私関西だよ
そそ	私はあおちゃんといっしょー 
里奈にはいつも感謝してるよ	私の本名の漢字を晒すなッッ
すき	私も大好きです 
憧れ	私もです
おはようございます	おはよう。私も支度しようっと…
休息一陣子吧。很傷……	私我私照給你
いいねぇありがとう	私は芋焼酎好きでしたね
神	私は絶対屈しない
ねえ、愛してるよ	私も愛してます
眠れないある	私も5時間しか寝てないし首痛い
暇になってしまった…	私原稿するね
きみのことがすき	ぬきくんお疲れ様 私もすきだよ
かんとーうですよ 	中部の私に今から来いと 
懐かしい 実家にあったかも 	私の家にもありました。
笑庶民感覚でホントの庶民です	私もです
うんチケット取ってきてねっ ️	私のメリットとは、、
週一の休みですよ 	ごゆっくり 私も休みです。
寝れん…	私も寝れなさすぎて荒野してました
