 ´・ ・。 起きちゃった……	あら 私の変な声でも聞く w
やってやろうじゃんか	なおその場合頑張るのは私
はらへった      	私も自爆しててしにそう  
悪口すきは性悪でくさささ	いや、私クソ女神でもりりり
少しガチマやるようにする がんばる 	私はちょっとガチマお休みする
1921かな 	そしたら私一つ前の枠だー
やっぱそうか	私は皿うどんの方が好きだよー 笑 
脳内にラズベリードリームが流れた	私はまんま『MOON』が笑
ほんと やったあー 	私もそんな時代があったない
りこる  ありがとう  ほんとに好き	いえいえ 私も好き️‍
スマブラめっちゃ難しい	私のセンスの無さ神ってるよ w
多趣味だから、雑多垢いいなって思う	私もです。忙しい忙しい 
駐車難しそう      	私駐車苦手なので横付け限定です  
野良救援のホルスにリリンクの鬼を見た	私が団に流しました
死ぬまでしっかり沼に浸かってます 	私もでーす
鍵垢あるで	良かったら私の鍵垢と繋がりたい、 
あんこさんって感じや 	ね  私っぽいの選んでくれた    
私が意地でも会いに行く	私だってお金貯めとくもんっ    
DM荒らしまくれー笑	私ももう1人の人に嫌われてる説ある笑
明日のグモニの表情差分を無駄に作っている	奇遇ですね、私もです
誘われてない	私が誘われたの 
明日も	そろそろ、私も干し肉デビューしますか 
カトクでもいいですか  	おお 以外ですね。私はかまいませんよ
行く予定 	いいな  私の分まで楽しんで 
さとちゃん 了解️	私はなんて呼んだらいい 
1人で寝ます	夢で私に会えるよ
エ、結構いるなんであるの 	私ない 美味しいの 食べ物 
ほんとにやらん	私からの好感度を失いましたあーあ
鍵あるよ 	良かったら私の鍵垢と繋がりたい  
だいすきだよ。	私もだよ
ほらみろお腹すいてきた	私なんか食ったよ
りのちゃん  絡も	絡も  てか私もTWICE好きなの
合ってたん  w	え、あ、私が忘れましたwwwwww
正式名称わからん      	私ふぁぼっとって名前つけた
潜り込んで聴いてたい。	かきたん私は貴方と話したい。
微妙でしたw引かなきゃ良かった	私もまずまずでした
鍵垢ある  ‍️	良かったら私の鍵垢と繋がりたい、、 
寝ようとしたのに寝れないというね、	私も絵描きしてる
何杯行ける あたし5杯	私は7杯さすがに流れ込んでく
そうだね夢は叶えるもの	の夢は私達の夢️‍
やんなぁ  	ちな私も岸推し
わいちゃすち	私もすきです
私も似たり寄ったりよ 	私からしたら十分変化付けてると思う
やばい、疲れてねむい	マジで私まだ元気なんだけど
えーすきー           	私も好きー     
ゆあちゃが今日も元気にいいねしてる	ゆあちゃとは私のことかな   
cute   	これカメラ向けてるの私達ですもんね
有小哥哥來認識嗎密我秒回	私密了
見た見たテンション上がったよ	私も 
2番️	私も愛してる
メリケンサック  ╹ ╹ 	私も思ったwww
嘘なんてついてません	ならいいけど…じゃあ、私もやる
なぜみんな目とかいろいろ晒せるのよ…	私もしたいができんニャ
マリンちゃんの以外いらないので	私もそうだよ
助けてくれー	私に助け求められても
海外でそういうことが起こってるらしい	私らもせなやばいかな  ´・ω・  
この時間俺は沢山ツイートするからよろ	私も夜型だから大歓迎だよ 
はるちゃんすき	私もすき
爽やかさん  行ってみたいんです  	私も最近行けてないので行きたいです
テレビ流してたら関ジャム告知来てびびった	え、それはビビる私もみたい
つむつむわらう全然やってないわ	私はアインストールした
あんこって感じだね	ほんと   私っぽいかああ  
そういえばまともにパンツ描いたこと少ない	私のお稲荷さん  
bbおるやん羨まC	私の勝ち 
俺可愛い	私かわいい
知ってる人フォローするからリプしてみて	美容師の私
呼ぶ必要がないかもしれない	私にとっては需要しかない
ふうりもおやすみ 	私もまだ寝ないけどねっw
私もゆペンです  	私ののぺんです 
変なおじさんでた	あっ私のことですねそれ
とりあえず面接でヘマしたくないです	私は面接ヘマしかしません ポンコツ 
おん    元気してた 	キムジュさん︎私ずっと元気 笑
酷いやつめ……私を裏切るから…	私も裏切られてんだよなぁ  
すきだああああ 	私もすきだああああ 
オレ明日も行くので来ないでください  	私のために踏み台になってください  
あ めちゃくちゃ忘れてた笑	大事    私も忘れかけてる  
頑張ってね	ありがとう 頑張った私 
これだから男は	私の知ってるマヤちゃんじゃない… 
なんと200円しか手持ちないよう 	あら大変私が奢ってあげる
コンカフェ行きたい ᐡ߹𖥦߹ᐡ	こみたんママ私も一緒にいきたいです
好きだから	私も好きよ
もっとください️	私はよっさんの笑顔が好き
寝れない、まじで暇。誰かと話したい  	私眠たいけど、スマホから手が離れへん
らんちゃんって呼びますね	私はなんとお呼びすればよいですか
嬉しい万舟でした	私の1ヶ月ぶん
愛でる雰囲気ぺーちゃん笑	実質私は梨加ちゃん ごめんなさい 
目力強かったww	私の当時の先生台パンしてたwwww
よく分からないですw	私もよく分からないwww
窓破壊され過ぎでは 笑 	私もそう思います。はい。とても。
いや炭酸飲みたくなったやないかい	え、私のせい www
おやすみー	おやすみなさい…私も…眠いです…すー…
楓「負けません 」智子「私も 」	ちせ「私も 宇宙拳法のトレーニング 」
お腹ぷよぷよしてるから…	私この動画見てかなり腹筋鍛えれたと思う
もうおじさんなんだよな…	そしたら、私もおばさん、、、、
胡桃は大和撫子って感じではないな…	アイコンじゃなくて私自身のお話
15万くらいかな	凄い私、4000ポイント
陰キャに言っちゃだめwwwww	大丈夫私も陰キャ  
え、言っていいのかこれ	私の知ってる人か知らない人か
身体中が震えてる本当にお願い生きて	私がきたぁ 何があった
上がってきてやろ 	私見守るが係だもん  ω  
だってつばさちゃんが言ったんだよ	私️私なんか言ったっけ 
ちょうどいい	私としてはもっと痩せたい所存です……
いい朝だね	こんなに暗い朝は私はじめてっ  
主に深澤さんが言ってそうwwww	私も混ざりたい
それ、4人で視察しに行こ	ちなみに私3 6千葉にいるよ
同じくー。幽霊調査みてる	私も幽霊調査見た事ある 
ふわとろにならないのw	多少じっくり焼かれてるのも私は好きぞ
タノシミニシテルよ	私から自主的にやることは無いけどな
おねむももう寝ちゃお優等生になれる	私も若干ねむい
いっぱいリプするね	私もする 
俺男なんだけどな	そうなのか私は女よ笑笑
耳いてぇwww	私出たよww
デレデレしやがってwww	私だってデレデレするもん www
ねえ、愛してるよ	私もだよ
そして画像は岡崎京子すきです	岡崎京子、私も好きです
やとさんきらい 	私というものがありながら、、
私出たよww	私も出たw
すいません降参	はっはっはぁ、私の勝ち️
こちらもいつも感謝です。‍️	私もありがとうございます
キャラデザも好みです 笑	いいよね 私も好き 
3月はたぶん19日は行くよー 	えええ  私も19行く予定   
気のせいです。気合いであがってください	私今LINEで通話なら永遠に言えるよ
これ引用していいです 	どうぞ   私のでよければ   
そんなことないわ  www	私、頑張る 
スキ	私も好きだからー     
手前 俺は既に通り越したよ  笑 	かっこいー私なんてまだまだだった…
一咲うんこフローラルってなに 	私たちが聞きたいw
銃兎   大好きです   	私も大好きです、独歩
え 	私の推しです
裏切り者しかいねぇ	酷いやつめ……私を裏切るから…
あぁ     お前は 	私 にゃんっ 猫の真似して 
すき	私も好きです️
クレープ食べたくなってきた…	私の絵でクレープ欲そそられたの嬉しい 
飲んで入ったことない事は無いですけど	私も嗜む程度は
蓮くんとよなjamのお友達欲しい	そういえば私の友達は DM送りなさい
わたしも	やっぱ私達、お尻合い…だったんだね…
塩対応されたら泣きます	私は常にあまあま対応だよ 
癒し   	私も欲しい
どこもあざとくないよ	私があざとくてゴメンッ
可愛い にわとりマスターもいるw	私の親鳥だからね笑笑
しずくさんの反応マッハで最高です	どこだ…どれだ…何した私…
お邪魔しても……いいですか…… 	私の鯖に移動しました
知らんけど強くないでしょ笑笑	私もわからんハナホジ
雑魚乙	まあ私の元には梅と韓国のりもあるから
お先にフォロー失礼します‍️	私もフォロー失礼します  
勝手にみんなと見るつもりでいたwww	私も勝手にそんなつもりでいたwww
またお逢いしたいです	私もです
えへへ⸝⸝すみれ大好き	もふかわいい  私も大好きだぞ 
それな 絶対会うんだからっ	私が意地でも会いに行く
甘やかしに	私があまえるの 
俺も9時起き 煽り 	殺しそう、その時間教習所まで行ってる私
ぜひ 先にフォロー失礼します	私もフォロー失礼します 
おk死んでくる	私に食われるまでは死んじゃだめやぞ
仲良くしたい	私もそう思ってる 仲間だね
ボクってほぼ独りだからさ…	あなたは私のライバルでしょ… 
頭どうしたw	頭…私の頭どうした…༼´  ౪  ༽
まりちゃんありがとう  逢いたいな  	私も ๑ ᴗ ๑ 
らぶだよ        会いたい 	私通知勢なんで   見てますよ   
つよつよでした	私なんもやってなーいᐠ ᐝ̱ ᐟ
ぶすぼすぎてみみなくなるよ  	私ガサガサだからお互い様で   
え、めちゃすき	私が 
ちなみに今ん所3人としてる	3人の中にひとり私でちゅ
そうね私の財布を守ってくれ	君の財布は私のものさ
かえでちゃんって呼ぶね   	了解 私はなんて呼べばいいかな  
わーい嬉しい いっぱい絡みにいく️	やったね 私も行く 
えっ    ひらけばよかった、、 	私は今からでも行くけど寝るかい
おやすみかわけんいち  	おやす美川憲一私が使うさよならの言葉
無気力	私もテスト続きで無気力
かっけえ️	私この人についていくことにした    
どの垢 	私このアカウントしかないんですが…
疲れ吹っ飛んだ好き	しうさんすき私の嫁
違いますねそれ買い垢アレルギーですよ	私が買ってるって事 笑
ごめんなさい、もう一人の方が来なくて	私の友達はcになることができます
火花を散らす	楓「負けません 」智子「私も 」
水瀬さん通話しましょう	私彼氏いるので️️むりめぅ
らた愛してるよぉぉぉぉぁぁぁ     	私のが愛してます ˇωˇ 
出たら使うわ   笑笑	私は出ても使わない……
通知オンにしてるから大丈夫そ   	え    私の       黙れ 
一緒に幸せになりたいなあ	私も絶対一緒に幸せになろうね
コミュ障すぎてやばい	まぁまぁ私も同じなんです お前誰 
ありがと	私の事好きじゃないの 
1番目のキッズを支えてチャニで支えて	おまかせをー私もこれやりたい
わかる……	だよねー 私朝起きれる気しない、、
なんだよ今からシコろうと思ってたのに	聞いた私がばかだった早くシコってこい
猫といっしょ、発送準備開始だって	あやねちゃん私もだよ
さいこう今はアンビが熱いけど	私も️️今まじでキてる
やだあああああ	ふふふふふ病みそう私難しすぎる
マスクで顔が荒れる ´・ω・｀ 	私もです ´ ω ｀ 
どっちが書いたの 	これは私が描きました…
ええ  いく  	やった 私もから見に行こっ 
すげぇ…俺はまだTスピンも出来ねぇ…	あっ…私もTスピンはまだ…
あんがとぉー	私にだけリプ返はやいのすき
そのためのモンパスでもあるからね笑	あ 私の本垢のモンパスが 
 ´ ω ｀ ブフォwww	私は本気️ダーリン反応せんかなー
天才か   	やっぱり   私天才  
中壢忠貞 現在找好吃的肉棒 老胖勿擾 	可私 
そんなアナタにホットTENGA	私をテンガ代わりに使ってください。
普通‍	私優しいから返してあげるね 鬼 
原稿終わらなすぎる	私も・・・
人生の先輩のお悩み相談でもやる 	私は悩みないんよな
あ、女性だったんだ知らなかったわ笑	男子だと思ってたんだw私は女です 
YES 推し 	私はsoftmodがお気に入りかな。
うちも嬉しい 誰推し  	私の推しはかっちゃんだよ️
バスカヴィルや	カルビそんなに食べたったのかしら、私
今日はカレー食おう	私も今日カレー食べました  
それな サムのお誕生日しっかり祝う	私も祝う 
うん…	…私でよければ相談くらいには乗るが
それは天才すぎるw普通にうらやましい	私最強だから
ぷろぽず	ヒスンではなく私を選びなさい
バスラか、いけるかな…	私バスラ当たったら行くで
記念にスクショした笑	私もスクショしといたww
いやないないない	事実なのです。私には彼氏ができません。
えかわい	さすが私の旦那
煙が出た時に何か起きたのかな 	私の部屋じゃないんだが本当に
成績が物語ってるよ… 	私もや
自垢以外で初メンションしてみた	好きなんだけど私だけにしてね
のんたん17歳 	そう なので私も17歳
大号泣なんですけど	私が代わりに肉まん食べてくるね   
ネットは声良い奴が勝つからなwwww	私も声作ろっと
2タイプwwwwwwwwwwwwwwww	私前者被るね 
そうなんです私フェタイムしてないの←	私もしてない
プラチナ軍団「ムキー  」	すまんね、私は先へ進むよ…
わかります。笑私も密かな楽しみです	ね️持って帰ってきたら私のもの
私寝るww私もまた練習しとこ	おやすみ私燃えてるスプラ楽しい
します………… 泣 	頑張れ…私が死ぬほど応援しとる
自撮り自信なくてしないから羨ましいまじ	ごめん私もない
即落ちはさすがにないかと  	私の即落ちは日常ですので
かずのこじゃなく  	私のキャラと組んで 
しぬその血受け継いでんのよ	私たちいつまでもあの先生の生徒だね笑
りこちゃんってお呼びしますね 	はい 私はなんとお呼びしましょ 
 ̗̀すき̖́ 	ありがとう大丈夫私も好きだ は 
れんって呼んでください 	了解です私はタメで大丈夫ですよ 
いやいや、むしろ遊んじゃうだろ。	よく私をご存知で
ぐえ 	まだまだ私には勝てんぞ…←
1125Pで水が10個かぁ 	はい先程私はそんな感じでしたよ
かれしだ	ごめんね私と通話中なんだ
まじしんどい草になりたい	じゃあ私はになる
最高すぎるよねあのチッケム一生見てる	それね  私も一生見てるもん
おそらく徒歩圏内な気がします笑	私環七超えてすぐのとこです
寝よう。俺ら頭おかしくなってる。	私まだ寝れない
あい おやりはしたら寝る 	私もそろそろ寝なきゃだわ∩ ω ∩
恋しそう	私もうしてる  
早く終わらせて楽になりたいので……	私も脱稿をお祝いしたいです…………
すきだぁぁ߹ᯅ߹ 	私も好きよぉぉ  gt  lt  
あら似た者同士 気合うね	私達、相性良いのかもね
普通にびっくりしたよwww	私もタイムリー って言ってた
急に歌いたくなってウタッチャツタヨネ	私も歌って帰るわ️
お風呂1時間かかるのばぐだよね	1時間半かかる私とは
強気の真打ち登場でしぬWW	私に言ってるのかとおもったわ   
BTS好きになってよかったなあ。	通りすがりに私も毎日思ってます  
JJI前くれた自撮りちょーだい…	私にもくれJJI…
APEX上手くなるとモテるらしい	私からモテます
とうらぶ無双面白い	私の虎徹…
天使       もう一生愛す	天使だぞ 私も愛す
今日会えなかった人明日会おうね	私 夜いる 
「多分私が初めてかな 」ここすき	そこ私も気に入ってるから嬉しい
スノボ行きたすぎて震えてる	私スノボできないよ
遠回りなかまちょはやめた方がいい…	私は今構えるぜd  ∀   
リプ返開始  	私の事認知してる  
テスト間近なのに何もやってなくて	私もなーんもやってなーい      
後悔されたい	すちゃんは私が幸せにする
なかよちこよち	さすが私たちだわぁ
ウズラの卵下さいな	私が産むからちと待ってて
はいっ。よろしくお願いします	ありがとう、私は園神凜祢。よろしくね
やったぜ   	私優しいもん   え 
私寒さに弱いから	私も寒いの弱いんダ 
あっしたは秋葉原	私も取引で秋葉原にいるー
わたしもノート使い終わったことないかも	いたジャン見ながら、私も同じくです 
俺が死んだら責任取れるんかお前	お前も私がしんだ時責任とってくれたか 
はーいそうでーす	あなたは一生私のそばにいてください
使わねぇな変態はぽまえだけだ…	セラ、私とおんなじ臭いするしけど
きっともうみんな寝たよね	 私はまだ起きてるよ、、、 
金欠すぎて引きこもってたww	私も金欠
そうか、皆さん、フェタイムか	そうなんです私フェタイムしてないの←
世辞はいいから八上をくれ	私もそう思います。
円萌も幸せニナリタイデス	私もなりたいです ੭˙꒳˙ ੭
眠い	私も眠い
お姉ちゃんだって起きてるでしょ 	私は昨日5時まで起きてましたから………
で、シンジくんでマジで誰だったんだろ…	私も気になっている…
静かにリアタイする	私、配信→リアルタイムです
ひまひまー	私も
かわちいじゃん←ゆーちゃん	️私 笑
これは最高ですよ	私も一緒に 
＼こよみーん️ 	私のファンですか    
明日でダイヤ踏んでおきたいからなあ	はや まだ私プラ4です笑笑
おいしー	実は私もいちご買っているのだ️
銀山温泉行きたいー 	私も行きたい春夏秋冬で行ってみたい
⠀とてもみつリスすき  ちゅ  ⠀	私もすき  
タコピー読んだけど鬱になった	ちょうど私も昨日読んで絶賛鬱 
ゆきのぼーかるで	もちろんです、私でよければいくらでも 
これからやりまーふ	私寝るww私もまた練習しとこ
どどどどどしよかな 	私もシージ持ってます ´   チラッ
太郎ちゃんも異次元に凄いよ 	私は日雇いですから。キリッ
なかないで   	ぴえんに、私はなる ←
今日夜ふかしします   ˙ ˙ 	私も今からお風呂入ります  
まるちゃん、カミになりたいよ	ピリペンだけど私もなりたいww
えみなだよ	私
いやだってゆくのん足にしかあt   	私色んなところに当てちゃうよ 
リプ返開始  	      いま私のことみたね 
犬だとさ笑	犬かーいおすずと私ら似た者同士
いやめちゃ面白いですアフリカンです	私は日本舞踊おどりました
手が荒れる	私の手が荒れる きむてアレルギー 
小学生みたいなこと言うな	私ガキだからしょうがない
嘘ガチで好きだよ𝐈𝐋𝐨𝐯𝐞𝐘𝐨𝐮	ええ 私もだよ  
塩タン食べたい	私が焼いてあげようか
どうしたどうした	私もちょっとよくわかりません
私はあなたのお父さんと寝ました	なら私もあなたのお父さんと寝ました
アホらしいというか、ただのアホです	私アホだった ´    
んー何色がいいかなー	私に似合うのどれかなあ
一緒にやる 	私が暇なときたけしいない 
頑張って耐えます	私も車欲しいんだけどお金がねー、
好き  唐突	私も 
乙女とは	乙女とは私の事じゃない 
いぇす 	まさかの ええ 私めっちゃすき  
今から楽しみです	私もです  
え、すき	私もすきだよ
щ    щ くれ	私もお腹すいたわ
最近ほんとにペットボトルの蓋があかない	わかります。私も開けれないです。
いりのもまだお風呂入ってないんよ	おーさすが私たち気が合うな  
ヤメラレナイ…	私と関係組んで…
がちそれwwwwwww	私変人じゃないのに巻き込まないで
うえーんこない	それなwwwww私好かれてる 
俺ら誕生日おめでとう	私らお誕生日おめでとう
 ￣ ￣ 	私もためる
らてたん呼びするね 	私はなんて呼ぼ 
哈囉我是朴子人可以認識嗎	自己私
「何もしないにゃ   」	   「   私で実験とか   」
っNHKBS1	私の部屋のテレビ、BS見れねぇんだわ…
二重になりたい	私二重いひひごめんなさい
ハングゴ昆布スペはここですか 	違います私は韓国語ができません
まだまだ子供って思い知ります	そんなの私も子供やぁ ´ ω   
ひっさしぶりに質問箱やろっかな	あなたには私の姿が見えていますか
勉強中に納豆食べたくなるの私だけ 	勉強中に宿題食べたくなるのは私だけ  
ふむ、その意気だ	私は従者ですので、当然です
こう見えて全身震えてんだ  	私もお前のせいで全身汗びっちょりだよ
多少	私聊
繋がりたい 	私も繋がってたいお迎えいくね  
リプ返開始  	リプしながら寝かけてる私wwwww
おんな 	私男
オペラ座の怪人がいいなあ️	私も久しぶりにオペラ座の怪人見たい️
んなことねぇだろwwwwww	私というものがありながら
いろんななみだがでる	私も最近色んななみだ出てます
はああああすき    	私も 
淡い色の服きてこっ	私、オレンジ着てく
袖らへんのハートすき	キャラデザインは私のじゃないんよ 
病んだ	私も
え 人気でそうやん ー     卍	私が全ツッパとか苦手wwww
今、睡魔待ち	私も睡魔待ち…笑
誰www	え 私の友達のでんでん。
離れてくんないわ好かれちゃったかも	あれ 私浮気された 
ひま	そう言われても私何もできませぬよ
お 繋がろう  笑 	繋がる 私のどの垢と繋がる オタ 
やろやろおお終始ニヤニヤしてた	うん 私もこのツイ読んでニヤついた笑
ブロッコリーがあったんだが 	書いたの私だよってアピールだよ    
エラーって出た	私も今なんもできんし、全部エラー
あぁ、すき	もちのろんで私もすきだよっ 
  ・ д・´ ナン…ダト  	だってぇぇ 私は友達だと思ってるから
同い年APEX楽しそうだよなぁ	初リプ失礼します私同い年です
コメントができなくてないたよね	私もや
この変態めっ  笑	私は変態だ   HAHAw
負けたんかよ	私以外勝つわけなくね
いや、べつに	そうだよね私天才だよね
ばぶとペア画出来て嬉しい	私も一生このままでいい あ  
ダルゴナ こんなのあるんだ	私も初めて見たの。美味しかったよ  
誘ってくれる人は良き‍️	私の中では他の人より誘ってるのに
2 00ぐらいに多分お迎えくるꉂ𐤔	私は3時かなww
ひっさしぶりに質問箱やろっかな	そして私は何なんですか
みんなのことずーっと考えてる	私も同じ、つい考えちゃう
この返信多すぎやろw	みんな私のこと姫プしたいみたい
 これ長くなりそうなやつだ 	私が寝たわ 
うち失敗したから笑笑笑	w私も裏全部生だったw
 ´ ω  ウム だから声掛けた w	私まだお風呂なんよ  
私募集してみよwwww	私お金消えるやつ投票するwww
使い道ないのですね最高	そんなものしか私持っていません
アレンジは書いた	私が書き間違えたのごめんね
わかる  基本それ w	だよね私全然上手くならないw
エルヴィンスミスに遭遇したい	私もリヴァイアッカーマンに遭遇したい
僕は引いちゃったw	私もいま引いたよw
操作誰  	私だよwww
